id,type,name,n_names,yearpublished,description,minplayers,maxplayers,playingtime,minplaytime,maxplaytime,minage,mechanic,subdomain,category,lang_dep,users_rated,average_rating,bayes_average_rating,total_owners,total_traders,total_wanters,total_wishers,total_comments,total_weights,average_weight
89371,boardgame,The Russo-Georgian War of 2008,1,2010,"The Russo-Georgian War of 2008 is a DTP simulation game covering the military action during that conflict from August 8 2008 through August 12, 2008.  This involved full-on combat between the Republic of Georgia and the Russian Federation plus two breakaway regions of Georgia; Abkhazia and South Ossetia. The fighting began in the Ossetia (the primary Georgian target) and quickly spread to all of Georgia and Abkhazia.<br/><br/>At first glance this seems like a fight between David and Goliath - the vast Russian military against a state with only about 20,000 active duty personnel in it's military and only 7 combat jets - but closer examination reveals it was a somewhat stiffer competition with several points of interest.  It was with this thought that this game was inspired.<br/><br/>The game is relatively straight forward to learn and play and the system, while adapted to the conflict, very familiar to most wargamers.  Learning and playing the game can be done fairly quickly.  The game is play-balanced due to a selection of real-world scenarios, including the historical situation.<br/><br/>This is a Desk Top Published (DTP)game - gluing and cutting of counters is required.<br/><br/>SCALE - Game Turns represent 12 hours, units typically represent battallions of 500 - 1000 men plus some smaller and larger, units and hexes on the map are approximately 12 kilometers across.<br/><br/>",1,2,90,90,90,12,Hex-and-Counter,NaN,Modern Warfare,NaN,8,7.3125,0,21,0,4,4,4,1,3
89376,boardgame,Früher oder Später,1,2009,"Fr&uuml;her oder Sp&auml;ter is a card game issued by the Bundeszentrale f&uuml;r politische Bildung of Germany. The game has 61 cards, each one depicting one event of German history from 1949-2010.<br/><br/>The game contains two variants. The first variant is a simple guessing game if the hidden card from the top of your stack is earlier or later than the current open card. The second game is a bit more interesting for gamers. One player reads an event and the other players offer one of their events which should be as close as possible to the first event. The first player then decides which event is closest to his event. If he's right, he and the other player can keep the card. Otherwise, only the player who has played the closest card, can keep his card. Winner is the player who first gets 5 cards.<br/><br/>",2,5,30,30,30,8,Hand Management,NaN,Card Game,NaN,1,4,0,3,1,0,0,0,1,1
89378,boardgame,Supervivencia,1,1990,"A game about survival. The players represent a group of survivors of a helicopter crash in the middle of the Amazon rainforest. Each player has eigth starting objects and the goal of the game is finding nearest village (the end of the board). The first player to succeed wins.<br/><br/>Using the dice to advance, every now and then some player lands on a red dot, when this happens a &quot;situation card&quot; is revealed an readed out loud: some situation cards presents the player with opportunities while other with problems, for example you may need some object to advance, or some object to affect other players. Some cards represents goblal situations that affect all the players.<br/><br/>Also there's some trading and bluffing element in the way of how the game manages objects. Note: i got this game as a present for chrismas in 1993 but there's no record of the year of publishing whatsoever.<br/><br/>",2,6,80,80,80,10,"Card Drafting,Roll / Spin and Move,Trading",NaN,"Dice,Exploration",NaN,1,5,0,0,0,0,0,1,1,2
5988,boardgame,Wings Over France,1,1992,"Wings Over France is a solitaire WWI wargame, simulating the day-to-day operations of a RFC Squadron during the month of April 1917, known as &quot;Bloody April&quot; because of the heavy losses suffered by the allied air force. The game puts the player in control of 1 to 3 RFC Flights based in Arras, France.<br/><br/>The objective is to sweep the skies clear of Huns in support of the Arras ground offensive, but just surviving would be an achievement.<br/><br/>Each squadron has to undertake a number of missions each day (determined randomly), but with limited resources and personnel.<br/><br/>The various missions include rece's, bombing raids, destroying enemy balloons etc - but all will involve dogfights with enemy aircraft - with the game easily capable of handling over 20 aircraft fighting in the skies simultaneously.<br/><br/>",1,1,60,60,60,10,"Action Point Allowance System,Campaign / Battle Card Driven,Hex-and-Counter",Wargames,"Aviation / Flight,Wargame,World War I",NaN,46,7.47826,5.5944,107,7,25,66,29,9,3.2222
40134,boardgame,Le Tour Cycliste,1,0,French cycling game released at the end of the '90s.<br/><br/>,2,6,0,0,0,8,NaN,NaN,"Racing,Sports",NaN,0,0,0,1,0,0,1,0,0,0
5982,boardgame,Mothra vs. Godzilla,2,1982,"Part of Bandai (バンダイ)'s Game for Adult ~ IF series (meaning aimed at older players, not anything with objectionable content0.<br/><br/>Complexity 2 on Bandai (バンダイ)'s 1-7 scale (1=easiest)<br/><br/>&quot;If&quot; refers to the their gimmick of setting up each game in the series as a &quot;What if... (insert game scenario)&quot;<br/><br/>This particular game has Godzilla fighting other Toho movie monsters as a hex-based wargame. It has the same game designer as the &quot;Godzilla Computer Wargame 03&quot;.<br/><br/>Includes counters and 9 figures to represent the people and monsters. Map is made up of 2 mounted boards (double sided, making for two different 2-board-size maps).<br/><br/>The game is divided into three parts:<br/><br/>- Part I: Mothra vs Godzilla (scenario for 2 players). One player plays &quot;The Mothra Side&quot; (the defense forces, the civilians, the Shobijin (the little twin fairies) and the Mothra larvae. The other player is &quot;The Godzilla Side&quot;, just Godzilla. Godzilla approaches the coast from the sea in search of Mothra's hidden egg, with lots of chaos and destruction along the way. The Mothra player uses the defense forces and hidden tactics to slow Godzilla long enough to allow the egg to hatch so that the Mothra larva(e) can face Godzilla. The game uses the &quot;city side&quot; of the gameboard.<br/><br/>- Part II: Solo Game - provides rules for solitaire play of the Mothra vs Godzilla scenario. The player plays &quot;The Mothra Side&quot;, with cards and die rolls governing the movement and behavior of Godzilla.<br/><br/>- Part III: Rules for additional scenarios - provides rules for 4 scenarios in which additional monsters face off against one another. Stats for Mothra (adult), Rodan, King Ghidorah, Anguirus, Gigan and Mechagodzilla - as well as aliens controlling the monsters - are included. The game uses the &quot;island side&quot; of the gameboard.<br/><br/>",2,2,90,90,90,10,Hex-and-Counter,Wargames,"Science Fiction,Wargame",NaN,6,7,0,11,0,15,17,2,2,1.5
5983,boardgame,Xanadu,3,1987,"Based off the classic Falcom computer/videogame RPG.<br/><br/>Very similar in basic play to TSR's Dungeon!. You traverse the area, going into rooms to battle monsters and get treasures, including items needed to get into the final rooms in a castle to slay a particularly nasty dragon.<br/><br/>",2,4,90,90,90,10,Area Movement,NaN,Fantasy,NaN,4,5.5,0,5,0,0,4,1,0,0
5980,boardgame,Tokimeki Memorial 2 Game of Life ('Jinsei Game'),1,1998,"Loosely based off Milton Bradley's Game of Life, but it's really a different game. There's now dating squares, which is perhaps why the box says its for ages 15 and up. Includes 11 cute miniatures representing the 11 girls from the videogame.<br/><br/>",2,6,60,60,60,0,Roll / Spin and Move,NaN,Video Game Theme,"0,0,0,0,1",1,5,0,1,0,0,0,1,0,0
5981,boardgame,Tower of Druaga,1,0,"Based off of Namco's arcade fantasy game that had a twingle of an RPG feel to it.<br/><br/>This game plays very very loosely like Dungeon! but is even more basic. You move through each level of the dungeon to get a key. You roll a die for movement, take the shortest route towards the key, and after every roll (the game does not even have rooms or such), you have an encounter with a monster that you must fight. You get a treasure for each victory, and once you have the key, you can open the door that leads to the next level, and continue doing so on each level until you get to the 6th level where the princess is.<br/><br/>",2,4,45,45,45,0,Roll / Spin and Move,NaN,"Fantasy,Video Game Theme",NaN,2,5.5,0,6,0,0,4,0,0,0
5986,boardgame,Ra,1,1981,"This is a strategic game over hexagons, with easy rules, but is challenging to play with coordination. Victory will belong to whoever has the capacity to win but also to lose with intelligence.<br/><br/>Contents:<br/><br/>    Playing board in rigid thick cardboard and printed in metallic colours.<br/>    18 cylindrical pieces in rigid, coloured plastic.<br/>    Rule booklet in 4 languages with examples.<br/><br/><br/><br/><br/>Not to be confused with Reiner Knizia's Ra (1999).<br/><br/>",2,2,120,120,120,13,NaN,Abstract Games,Abstract Strategy,NaN,22,6.55455,0,54,1,11,17,9,2,1.5
5987,boardgame,Banditos,1,2002,"Players earn their money by making Bandito raids.<br/><br/>At the start, all the Banditos are four miles away from the banks. Mile cards are played in turn order so as to reduce that distance. The player who places the appropriate &quot;4&quot; mile card is finally able to rob a bank and get the dollars it holds. But you won't always have the necessary matching cards needed to reach that goal. Then, small gifts of money to the other players will help the right cards to come your way.<br/><br/>At the end of the game, the player who makes off with the most dollars wins.<br/><br/>",3,4,30,30,30,12,Hand Management,NaN,Card Game,NaN,17,5.05882,0,77,3,1,3,13,2,1.5
5984,boardgame,Epoch Wargame Electronics #1: The Battle In the Japan Sea,2,1983,"1st of 12 games in the Epoch Electronic Wargame Electronics series.<br/><br/>Each of the games features:<br/><br/>    Easy to learn rules (in Japanese)<br/>    Quick games that average about 30 minutes (not including setup)<br/>    Magnetic pieces on a set board<br/>    An electronic dice-roller with 6 LED dots to work out the effects of combat. <br/><br/><br/><br/><br/>As long as one player knows the rules, the other player does not need to know any Japanese in order to play the game.<br/><br/>This particular entry in the series centers around a naval battle between Japan and Russia in the Japan Sea during World War 1.<br/><br/>",2,2,30,30,30,10,Hex-and-Counter,Wargames,"Electronic,Wargame,World War I",NaN,1,4,0,2,0,2,3,0,0,0
5985,boardgame,Miscellaneous Game Accessory,3,0,"This isn't really a game, but it should be used to categorize miscellaneous game related items such as dice, dice towers, dice trays, timers, tokens, pawns and movers, etc. Items in the BoardGameGeek Marketplace may refer to items listed here.<br/><br/>If there is a more specific Admin: Miscellaneous Placeholder for your item, use it instead. For example, there's an entry for card game accessories, another for miniatures accessories, and others.<br/><br/>",0,0,0,0,0,0,NaN,NaN,NaN,"1,0,0,0,1",208,6.93803,5.76066,973,129,51,127,429,17,3.4706
103549,boardgame,Office Dice,1,2011,"Office Dice puts each player in control of one &lsquo;team&rsquo; of a faceless corporate giant, where the only currency is completed projects, and the only job security is never being noticed. Players compete against each other to put the finishing touches on each project to reap all the rewards for everyone&rsquo;s hard work. It&rsquo;s all about who handed in the report, not who did all the work. Oh, and watch your back, because every empty cubicle means someone is trying to get you fired while they&rsquo;re on break.<br/><br/>",2,5,30,30,30,12,Dice Rolling,NaN,"Dice,Print & Play",NaN,0,0,0,2,0,1,2,0,0,0
82449,boardgame,King's Vineyard,1,2010,"The King intends to appoint a new Master for his vineyard and wishes to discover which apprentice has the cleverest way with grapes.  The wily King will pay three surprise visits, judging the grapes for color, sweetness and vine length, dispensing gifts of goblets, bottles and barrels to demonstrate his appreciation.  After the final visit, the apprentice with the most valuable gifts will become Master of the King&rsquo;s Vineyard.<br/><br/>Object<br/><br/>Players vie to impress the King who judges each vineyard according to the number of ripe grapes, adding bonuses for sweetness, fruits of the same color, and the uniformity of the vines.  At the end of each royal visit, players tally their scores and collect the King&rsquo;s gifts as point tokens.  At the end of the game the player with the most points wins.<br/><br/>",2,4,45,45,45,8,"Hand Management,Pattern Building",NaN,"Card Game,Farming,Medieval","0,2,0,0,0",150,5.47613,5.48935,408,61,10,40,70,13,1.8462
155631,boardgame,Lass dich nicht foppen!,1,0,"Each player gets 3 meeples, which he has to get across the board to his finish spaces, which are also the starting spaces of another player. In his turn each player can move 1 meeple 1 space in any direction. No meeple can jump over another, so they get blocked a lot. The colored spaces on the game board may only be occupied by meeples of the same color. The first player to get all 3 meeples to the finish spaces, wins the game.<br/><br/>The game was likely published in the 1930s.<br/><br/>",2,6,0,0,0,0,Point to Point Movement,NaN,Abstract Strategy,NaN,0,0,0,1,0,0,0,0,0,0
103543,boardgame,Brawl Inn,1,2011,"In Brawl Inn each player rule a tavern , and they compete to attract the best clients and collect money to hire staff and buy furniture. <br/>In the tavern , you must serve drinks to clients to get money, but if you serve him too much , they can start a brawl!<br/>Choose wise wich clients will drink more, but beware with those who drink too much!!  <br/>Hire Staff as waiters and security  to improve your tavern and keep it safe from destructive brawls.<br/>You must make rise your tavern and start brawls on the tavern's oponent, buy furniture and winning the game obtaining the ultimate prize for a tavern...<br/>The mithril fork!<br/><br/>",2,2,0,0,0,12,"Betting/Wagering,Card Drafting",NaN,Card Game,NaN,0,0,0,0,0,0,0,0,0,0
155633,boardgame,Zombies Keep Out,1,2014,"It's bodge or get bitten in Zombies Keep Out when a giant mob of zombies attacks the goblins' workshop. Now it's up to you and the other bodgers to repel the undead or become a zombie's late-night snack!<br/><br/>Barricaded in your workshop, you and your goblin cohorts must rely on your mechanical expertise to construct the sometimes ramshackle but always maniacal machines you'll need to overcome the endless Leapers, Creepers, Runners, and Brutes trying to break down your doors. Collect parts to build your machines as fast as you can, but don't get bitten &mdash; or else you'll be left moaning and groaning as you join the horde and turn on your friends!<br/><br/>Zombies Keep Out is a fully cooperative board game for 1&ndash;6 players.<br/><br/>",1,6,45,45,45,8,"Co-operative Play,Hand Management,Trading",NaN,"Card Game,Horror,Humor,Zombies","0,0,1,0,0",142,6.39542,5.61788,332,22,7,38,40,11,2
82446,boardgame,Parade Spel,1,0,"A Monopoly like game.<br/><br/>Players move along a square board. They try to buy and sell properties. This game is situated in the Dutch city 's-Hertogenbosch. If another player lands on a space you own, you can collect the rent.<br/>When a player has all the property cards of one color, that player can build houses and hotels to increase the rent.<br/><br/>A player wins the game when the other players are bankrupt.<br/><br/>This game is produced to raise funds for a Child Abuse program.<br/><br/>",2,6,90,90,90,8,"Roll / Spin and Move,Trading",NaN,"Collectible Components,Economic,Negotiation",NaN,0,0,0,0,0,0,0,1,0,0
155636,boardgame,Level 7 [Invasion],1,2014,"The year is 2020. The world hovers on the brink of annihilation. Preceded by a devastating orbital attack, a warlike alien race known as the Hydra has besieged the planet, their invasion force carried on enormous drop ships that dwarf city blocks and rain devastation from above. The Hydra&rsquo;s ultimate goal is to eradicate the last survivors of their ancient nemesis, the Ghin, an alien race that has taken refuge on Earth. Humanity is caught in the apocalyptic crossfire. As widespread panic grips the populace, governments topple, economies crumble, and order dissolves. In these desperate days, mankind&rsquo;s only hope lies with the Ghin and one of their most brilliant minds: Dr. Cronos, a being as guilty of atrocities against humanity as those who hunt him.<br/><br/>LEVEL 7 [INVASION] is a standalone semi-cooperative game of global strategy set in the LEVEL 7 universe that follows the events of LEVEL 7 [ESCAPE], LEVEL 7 [ESCAPE]: Lockdown, and LEVEL 7 [OMEGA PROTOCOL]. As the planet is battered by the Hydra's relentless assault, you'll control Earth's desperation-forged coalitions in an effort to turn back the invasion. But soldiers aren't enough. You and your allies must manage your resources carefully to combat the threats of hysteria, famine, and population loss as well. Endure long enough, and you might buy the time for Dr. Cronos to develop the advanced weaponry required to defeat the invading Hydra. The survival of the human race depends on your next move!<br/><br/>",3,5,180,120,180,0,"Area Control / Area Influence,Co-operative Play","Strategy Games,Thematic Games",Science Fiction,"0,0,3,1,0",119,7.16361,5.69311,376,20,46,185,35,9,3.3333
36603,boardgame,Huuue!,1,2008,"A new horse-racing game, driven by card play. For each race, different horses are identified as favourites or laggards. You get more victory points for a bad horse finishing well than for a favourite winning the race. Players use cards from their hand to select which horses move forward and backward by different places. There is no race track. Instead, markers for each horse are re-ordered on the table as needed. This allows horses to run neck and neck, which affects how they move in later goes. Players secretly bet on their choice before each race and try to manipulate the result to their favour. After a few races, the most VPs wins.<br/><br/>",2,7,20,20,20,8,Betting/Wagering,NaN,"Card Game,Racing",NaN,50,5.806,5.51319,78,6,0,3,10,6,1.3333
36600,expansion,Origins: The Age of Reason,1,2008,"From the publisher:<br/><br/>This deck allows you to advance your Origins civilization into Era IV, the modern age. You must have Origins to play this expansion.<br/><br/>Contains:<br/><br/><br/>    Era IV Rules<br/>    Designer's Notes<br/>    55 cards<br/>    A New Short Scenario<br/>    Origins Errata and Optional Rules<br/>    Strategy and Card Tabulation<br/>    Frequently Asked Questions<br/>    Sample first turn.<br/><br/><br/>Expands:<br/><br/>    Origins:  How We Became Human<br/><br/><br/><br/><br/>",1,5,240,240,240,0,"Auction/Bidding,Dice Rolling,Hex-and-Counter",NaN,"Age of Reason,Civilization,Expansion for Base-game",NaN,70,7.49229,5.65227,337,9,31,49,38,7,3.8571
120120,boardgame,Fairfax's Revenge: the battle of Langport 1645,1,2012,"Introductory game for the English Civil War series by TCS Games, it is a small print &amp; play wargame on this minor battle from the English Civil War, more a fighting retreat and a sequence of cavalry clashes than a complete battle.<br/><br/>The game features the now classic system from TCS, made of random chit draw leaders activation, based on the quality of the leader himself, that leads to units activation and subsequent movement and combat.<br/>Each leader is rated from 1 to 3 (the higher the better, as he has more chance to be drawn earlier); when his chit is drawn from the pool, the player may move and have combat with all the units under his command. The activation is renewed for each other leader in the pool, except the last one that didn't move on that turn. there are no zone of controls (so movement is very fluid), terrain plays an important effect (as some terrain gives restriction to the attacker and improve the chances of the defender), combat is fast and furious (with advance, retreat and immediate elimination).<br/><br/>There are rules for melee, morale, cavalry charges, artillery and so on, with a very streamlined system that you may read and play in a few minutes.<br/><br/>Very good for introducing new players to the hobby, a sort of SPI quad games revisited and modernized<br/><br/>",1,2,30,30,30,8,"Chit-Pull System,Hex-and-Counter",NaN,"Civil War,Print & Play,Renaissance,Wargame",NaN,2,6,0,26,1,0,1,3,0,0
36601,boardgame,Wicce Hearts,1,2005,"A witchcraft themed card game.<br/><br/>The game is played using a custom deck of 36 cards. The deck is divided into four suits (Ankh, Pentagram, Familiar, and Item) numbered 1 to 9. The players attempt to win each turn by playing the highest ranking card from the same suit as the first card played on the turn. The winner of the turn receives all cards played on the turn.<br/><br/>The game is won by the player who scores the most points. Points are generally based on the value of the Pentagram cards held by your opponents. In addition, bonus points are awarded for holding certain cards or combinations of cards.<br/><br/>",2,4,0,0,0,0,Trick-taking,NaN,"Card Game,Fantasy,Print & Play,Religious",NaN,0,0,0,3,0,0,0,0,0,0
173157,boardgame,Takamachi,1,2014,"12 dice: 2 identical sets of 6 dice. And a 10 seconds sand timer. 2-4 players.<br/>Each set has 6 dice with 6 shapes in 6 different colors.<br/><br/>The dice are divided evenly among players.<br/>Thus, 2 players receive 6 dice, 3 players receive 4 dice and 4 players receive 3 dice.<br/><br/>Players roll the dice simultaneously and try to spot the higher combination of color or shape.<br/>The first player that thinks that he spotted the highest combination calls out loud the color or shape (whatever he thinks is the highest) and flips the sand timer.<br/>Now all other players have an extra 10 seconds to spot a higher combination.<br/>The player who was correct puts one of his dice aside and the games keeps on playing.<br/>The first player that has no more dice to roll wins the game.<br/><br/>Important: As there are two identical sets, sometimes there can be a situation of the same shape in the same color. This situation is called: &quot;Takamachi&quot;. The first player the spots a Takamachi wins the round automaticly.<br/><br/>",2,4,15,5,15,4,Dice Rolling,NaN,"Dice,Party Game",NaN,1,6,0,9,2,0,1,0,0,0
173156,boardgame,Timeline Challenge,1,2015,"Timeline is a card game played using 110 cards. Each card depicts a historical event on both sides, with the year in which that event occurred on only one side. Players take turns placing a card from their hand in a row on the table. After placing the card, the player reveals the date on it. If the card was placed correctly with the date in chronological order with all other cards on the table, the card stays in place; otherwise the card is removed from play and the player takes another card from the deck.<br/><br/>The first player to get rid of all his cards by placing them correctly wins. If multiple players go out in the same round, then everyone else is eliminated from play and each of those players are dealt one more card for another round of play. If only one player has no cards after a bonus round, he wins; otherwise play continues until a single player goes out.<br/><br/>Timeline Challenge incorporates the original mechanic of the series into progressive game track, of which players can move between 0-4 spaces per turn.  Players will have to make use of pre-determined time periods and guess where the incident depicted on the card occurred.  There are four different challenges, and they are played depending on the color of the game space of the lead player.  Additionally there are two further challenges which allow the two players at the back of the pack to catch up.  Although the game comes with its own cards, it can be integrated with any or all of the previous sets.<br/><br/>",2,10,30,30,30,10,"Betting/Wagering,Simultaneous Action Selection",Family Games,"Card Game,Educational,Trivia","0,2,1,1,0",538,7.14607,6.12148,1113,7,82,334,113,19,1.3158
173158,boardgame,IQubes,1,2014,"Categories with dice.<br/>5 letter dice have all the A-Z letters.<br/>2 Dice has 12 categories (6 categories each).<br/>20 coins to win.<br/><br/>The game is played simultaneously.<br/>The first player rolls 6 dice: one category die to his choice and all 5 letter dice.<br/>Now there is one category and 5 letters to choose from.<br/>The first player to call out loud a valid word that matches the category die and one of the letters, wins one coin.<br/>The game continues on this manner until there are no more coins to win. The player that collected the highest number of coins wins the game.<br/><br/>",2,4,15,5,15,6,Dice Rolling,NaN,"Dice,Educational,Party Game,Word Game",NaN,0,0,0,1,0,0,0,0,0,0
97152,boardgame,Pirati All'Arrembaggio!,1,2006,"In this dexterity game you and the other three captains have to manage your crew, and put those lazy pirates at work! The objective of the game is to carefully put all your crew members (represented by plastic stand shaped on a mighty pirate form, in four colours) on the ship, on the right colored level randomized by a spin weel. But be careful... The ships its's moving a lot! If you make other figures fall out of the ship, you have to take those in your crew!<br/>Only the best captain will put all his men on the ship, and win the game.<br/><br/>",2,4,15,15,15,3,NaN,NaN,"Action / Dexterity,Children's Game,Pirates",NaN,2,6,0,2,0,0,0,0,0,0
